논문번호,논문제목,논문사번,논문저자,논문게재일,논문게재지
368,"Effect of fibroblast co-culture on the proliferation, viability and drug response of colon cancer cells",00965,"고범석,전효진,김다희,강덕진,김광록",2019-02-01,Oncology Letters
369,Effect of growth temperature on the structural and electrical properties of ZrO2films fabricated by atomic layer deposition using a CpZr[N(CH3)2]3/C7H8cocktail precursor,00840,"안종기,정낙관,김진태,함성호,이근수,이성보,이태훈,박인성,윤주영",2018-03-05,MATERIALS
370,Effect of growth temperature on the structural and electrical properties of ZrO2films fabricated by atomic layer deposition using a CpZr[N(CH3)2]3/C7H8cocktail precursor,00999,"안종기,정낙관,김진태,함성호,이근수,이성보,이태훈,박인성,윤주영",2018-03-05,MATERIALS
371,Effect of high pressure hydrogen on the mechanical characteristics of single carbon fiber,00563,"전상구,권오헌,장훈식,류권상,남승훈",2018-02-28,APPLIED SURFACE SCIENCE
372,Effect of humidity on the calibration of the four-terminal-pair air-dielectric capacitance standards,00988,"이형규,김단비,김완섭",2016-05-01,MEASUREMENT
373,Effect of hydrogen on tensile flow and failure mechanism of low nickel-type 316L austenitic stainless steel,00779,"투안,박재영,남승훈,백운봉",2019-12-06,Journal of Mechanical Science and Technology
374,Effect of interfacial layers on the device lifetime of perovskite solar cells,01128,"임경근,지수근,김진영,이태우",2020-08-14,Small Methods
375,Effect of irradiation for sterilization on beverage reference materials for the analysis of food additives,00862,"안성희,김병주",2019-04-01,ACCREDIT QUAL ASSUR
376,Effect of low partial hydrogen in a mixture with methane on the mechanical properties of X70 pipeline steel,00563,"투안,박재영,김우식,남승훈,백운봉",2020-01-01,INTERNATIONAL JOURNAL OF HYDROGEN ENERGY
377,Effect of Neutron Irradiation on Properties of Pb(Mg1/3 Nb2/3)O3-PbTiO3,00686,"김용일,최남경,김건우,이윤희,백광세,김기복",2015-11-01,JOURNAL OF NANOSCIENCE AND NANOTECHNOLOGY
378,Effect of phosphorous on the electronic and optical properties of naphthoxaphospholes: theoretical investigation,01008,"문지원,김민비,임정식,김중한",2018-03-12,MOL PHYS
379,Effect of Sealing Time of Anodic Aluminum Oxide (AAO) Film for Preventing Plasma Damage,00840,"김진태,송제범,오성근,신재수,전제란,윤주영",2015-01-15,SCI ADV MATER
380,Effect of substrate bias on deposition behaviour of charged silicon nanoparticles in ICP-CVD process,00803,"유승완,유신재,김정형,성대진,서병훈,외부",2017-01-25,JOURNAL OF PHYSICS D-APPLIED PHYSICS
381,Effect of ultrasonic microdroplet generation in the low-temperature plasma ionization-mass spectrometry,00812,"이형준,임용현",2019-12-31,Mass Spectrometry letters
382,Effect of ultrasonic noise generated by pressure control valves on ultrasonic gas flowmeters,00785,"강웅,이생희,이승준,하영철,정성수",2018-02-19,FLOW MEAS INSTRUM
383,Effect of ultrasonic noise generated by pressure control valves on ultrasonic gas flowmeters,00961,"강웅,이생희,이승준,하영철,정성수",2018-02-19,FLOW MEAS INSTRUM
384,Effects of argon gas pressure on its metastable-state density in high-density plasmas,00803,"서병훈,김정형,유신재",2015-05-29,PHYSICS OF PLASMAS
385,Effects of doping and planar defects on the thermoelectric properties of InAs nanowires,00860,"전성기,박동우,신호선,박현민,최시영,이상준,유진,송재용",2016-02-01,RSC ADV
386,Effects of doping and planar defects on the thermoelectric properties of InAs nanowires,00889,"전성기,박동우,신호선,박현민,최시영,이상준,유진,송재용",2016-02-01,RSC ADV
387,Effects of Long-term Exposure of High and Low Humidity on Thin-film Humidity Sensors,01049,"이상욱,최병일,김종철,우상봉",2018-11-30,센서학회지 = Journal of Sensor Science and Technology
388,Effects of Molybdenum Addition on Hydrogen Desorption of TiC Precipitation-Hardened Steel,00563,"송은주,백승욱,남승훈,서동우",2018-05-01,METALS AND MATERIALS INTERNATIONAL
389,Effects of surface functionalization and polymerization on anode characteristics of plasma-synthesized silicon nanocrystal active materials for lithium ion battery anode,00803,"이돈성,이동명,유승완,김정형,정현담",2019-12-25,Journal of Industrial and Engineering Chemistry
390,Effects of temperature and pressure on sulfurization of molybdenum nano-sheets for MoS2 synthesis,00903,"김태완,라우프섀자드,강상우",2017-11-01,THIN SOLID FILMS
391,Effects of the sample clock of digital-output MEMS accelerometers on vibration amplitude and phase measurements,00432,정완섭,2020-01-01,METROLOGIA
392,Efficiency enhancement in InAs/GaAsSb quantum dot solar cells with GaP strain compensation layer,01142,"김영호,Keun-Yong Ban,Chaomin Zhang,김준오,이상준,Christiana B. Honsberg",2016-03-07,APPLIED PHYSICS LETTERS
393,Efficiency enhancement of fluorescence blue organic light-emitting diodes by incorporating Ag nanoparticles layers due to a localized surface plasmon,00999,"남민우,정낙관,심섭,윤주영,김진태,표성규",2017-09-15,Journal of the Korean Physical Society
394,Efficiency improvement of Si quantum dot solar cells by activation with boron implantation,00692,"곽계영,김태건,홍성웅,김안순,하만효,김경중",2018-04-01,SOLAR ENERGY MATERIALS AND SOLAR CELLS
395,Efficiency limit of InAs/GaAs quantum dot solar cells attributed to quantum dot size effects,00860,"한임식,노삼규,이상준",2016-10-01,SOLAR ENERGY MATERIALS AND SOLAR CELLS
396,Elastomeric high-κ composites of low dielectric loss tangent: Experiment and simulation,00809,"고영표,성봉준,김종호,김희숙,윤형석,권설기,이현정,박민,전인수,임정아,청성준,이상수",2020-08-18,COMPOSITES PART B-ENGINEERING
397,Electrical and Thermoelectric Transport by Variable Range Hopping in Thin Black Phosphorus Devices,00983,"최선재,김범규,이태호,김윤호,Zuanyi Li,Eric Pop,김주진,송종현,배명호",2016-07-13,NANO LETTERS
398,Electrical Conductance Change of Graphene-Based Devices upon Surface Modification for Detecting Botulinum Neurotoxin,00652,"김대희,김호종,심승보,정수용,이남희,남승훈,신의철,윤완수,하동한",2017-06-06,Japanese Journal of Applied Physics
399,Electrical hysteresis of ultrathin silicon oxides induced by heavy boron doping,00970,"엄대진,문창연,구자용",2018-10-28,JOURNAL OF APPLIED PHYSICS
400,Electrical Properties of Multi-Walled Carbon Nanotube Yarns depending on temperature,00563,"장훈식,전상구,남승훈",2016-11-01,JOURNAL OF NANOSCIENCE AND NANOTECHNOLOGY
401,Electrical tuning for sensitivity,00810,"김건우,황영인,서무경,김기복",2020-08-03,Journal of Mechanical Science and Technology
402,Electrically Controlled Magnetoresistance in Ion-Gated Platinum Thin Films,01029,"김동석,민길준,채동훈,전지훈,김태엽,주성중",2019-09-01,JOURNAL OF THE KOREAN PHYSICAL SOCIETY
403,Electrochemical biosensors: perspective on functional nanomaterials for on-site analysis,01123,"조일훈,김동형,박상수",2020-02-04,생체재료학회지(Biomaterials Research)
404,Electrochemical properties of composite cathodes using Sm doped layered perovskite for intermediate temperature-operating solid oxide fuel cell,01058,"백승욱,Abul Azad,John Irvin,최원석,강현일,김정현",2018-02-28,APPLIED SURFACE SCIENCE
405,electrochemical properties of Sn-decorated SnO nanobranches as an anode of Li-ion battery,00889,"신정호,송재용",2016-05-01,NANO CONVERGENCE
406,Electron energy distribution modification by RF bias in Ar/SF6 inductively coupled plasmas,01097,"이효창,정진욱,김정형,성대진",2019-08-05,APPLIED PHYSICS LETTERS
407,Electronic and Molecular Structure of the Transient Radical Photocatalyst Mn(CO)5 and Its Parent Compound Mn2 (CO)10,01065,"조하나,Kiryong Hong,Matthew L. Strader,Jae Hyuk Lee,Robert W. Schoenlei,Nils Huse,Tae Kyu Kim",2016-06-20,INORG CHEM
820,Preparation of gaseous CRMs from the primary system for 222Rn activity measurement,00783,"김병주,김병철,이경범,이종만,박태순",2016-03-14,APPLIED RADIATION AND ISOTOPES
821,Preparation of Helium Isotope-certified Reference Materials by Gravimetry,00771,"제임스,민들레,이진복,김진석",2015-02-10,Bulletin of the Korean Chemical Society
822,Preparation of primary reference material of argon in oxygen by the gravimetric method for application to thermometry,00875,"양인석,이진복,문동민,김진석",2017-02-15,METROLOGIA
823,Preparation of primary reference material of argon in oxygen by the gravimetric method for application to thermometry,00771,"양인석,이진복,문동민,김진석",2017-02-15,METROLOGIA
824,Preparation of single-phase SnSe thin-films and modification of electrical properties via stoichiometry control for photovoltaic application,00889,"정기욱,김재경,Oki Gunawa,배성렬,김수현,송재용,이윤석,신병하",2017-06-12,Journal of Alloys and Compounds
825,Preparation of soluble isotopically labeled human growth hormone produced in Escherichia coli,00969,"이진희,정지선,김숙경,송지명,이지연,백소윤,최준혁",2016-11-01,J CHROMATOGR B
826,Prevalence of work-related Musculoskeletal Disordes in Auto-mission Assembly Plant Workers,00624,"민승남,무랄리,김동준,박세진,이희란,이호상,김정룡",2015-08-31,대한인간공학회지
827,Probing drug delivery and mechanisms of action in 3D spheroid cells by quantitative analysis,00996,"홍아름,허채은,김민지,이종화,채수연,성기웅,이지원,허성우,김준곤",2020-12-07,ANALYST
828,Probing Electronic Strain Generation by Separated Electron-Hole Pairs Using Time-Resolved X-ray Scattering,00905,"이수형,조원혁,Anthony D. DiChiara,Timothy P. Holmes,Stephen Santowski,조용찬,Eric C. Landahl",2019-11-01,Applied Sciences
829,Probing Interfacial Surface State Excitons in Nanoscale Synthesized Cu x S/MoS 2 Heterostructure,00903,"라우프섀자드,문지훈,김태완,강상우",2019-03-22,ADVANCED MATERIALS INTERFACES
830,Probing organic ligands and their binding schemes on nanocrystals by mass spectrometric and FT-IR spectroscopic imaging,01104,"손진경,한상우,이태걸",2016-02-28,NANOSCALE
831,Probing organic ligands and their binding schemes on nanocrystals by mass spectrometric and FT-IR spectroscopic imaging,00816,"손진경,한상우,이태걸",2016-02-28,NANOSCALE
832,Proficiency testing for total mercury in oyster with a metrologically traceable reference value from isotope dilution mass spectrometry: implications on laboratory practices using mercury analyzers,00906,"김휘진,황의진,박좌행,허성우,임용현,임영란,임명철,이종화,이경석",2019-08-01,ACCREDIT QUAL ASSUR
833,Protocol for maximising light signal of metallic magnetic calorimeters for neutrinoless double beta decay search,00836,"오승윤,김건보,김혜림,김인욱,김소라,이혜진,이민규,김용함",2017-07-06,Superconductor science and technology
834,Proton spin-echo magnetometer: a novel approach for magnetic field measurement in residual field gradient,01071,"심정현,김기웅,이성주,유권규,황성민",2015-05-15,METROLOGIA
835,Purity Assessment of Fumonisin B1 by Quantitative 1H NMR Spectroscopy,01075,"윤수연,윤정빈,김병주,안상두,최기환",2020-04-01,BULLETIN OF THE KOREAN CHEMICAL SOCIETY
836,Purity Assessment of Monosaccharides using Mass Balance Method,01100,"이선영,권하정",2020-09-20,BULLETIN OF THE KOREAN CHEMICAL SOCIETY
837,Purity Assessment of Monosaccharides using Mass Balance Method,01047,"이선영,권하정",2020-09-20,BULLETIN OF THE KOREAN CHEMICAL SOCIETY
838,Purity assessment using quantitative NMR: establishment of SI traceability in organic analysis,01075,최기환,2020-03-20,Journal of the Korean Magnetic Resonance Society
839,Purity assignment of 17α-hydroxyprogesterone by mass balance method to establish traceability in measurement,00564,"이화심,박수진",2019-12-03,분석과학 (ANALYTICAL SCIENCE & TECHNOLOGY)
840,Purity assignment of 17β- estradiol by mass balance method,00564,"이화심,오광훈",2017-10-11,분석과학 (ANALYTICAL SCIENCE & TECHNOLOGY)
841,Qualification for Impedance-based Rain Detectors,01049,"이상욱,최병일,김종철,우상봉,김용규",2017-06-09,센서학회지 = Journal of Sensor Science and Technology
842,Quality Assurance and Control Issues in Multi-Center Diffusion Tensor Imaging Studies,01013,"서영섭,N. Rollins,Z.J. Wang",2015-09-28,CURR MED IMAGING REV
843,Quantification of Folic Acid in Human Serum Using Isotope Dilution Ultra-High-Pressure Liquid Chromatography/Mass Spectrometry,01020,"형석원,이준희,외부,김병주",2018-01-04,BULLETIN OF THE KOREAN CHEMICAL SOCIETY
844,Quantification of regional contributions to fine particles at downwind areas under Asian continental outflows during winter 2014,00993,정진상,2019-08-01,ATMOSPHERIC ENVIRONMENT
845,Quantification of single-strand DNA by sequence-specific counting in capillary flow cytometry,00871,"유희봉,이채은,홍기석,박상열,양인철",2020-12-01,METROLOGIA
846,Quantifying the level of nanoparticle uptake in mammalian cells using flow cytometry,00994,"신혜림,곽민정,이태걸,이지연",2020-08-07,NANOSCALE
847,Quantitative analyses of essential fatty acids in cereals and green vegetables by isotope dilution-gas chromatography/mass spectrometry,01047,"이선영,임동규,백송이,서동원,박종수,곽병만,원종은,이준희,김병주",2020-08-25,Journal of Analytical Science & Technology
848,Quantitative analyses of factors affecting thermal conductivity of nanofluids using an improved transient hot-wire method apparatus,01010,"이주현,이한슬,백용진,구준모",2015-06-03,INT J HEAT MASS TRAN
849,Quantitative Analysis of Cell Proliferation by a Dye Dilution Assay: Application to Cell Lines and Cocultures,00994,"정수빈,김설희,서유리,김숙경,이지연",2017-04-04,Cytometry  Part A
850,Quantitative analysis of cholesterol in infant formula by isotope dilution liquid chromatography-tandem mass spectrometry,00564,"안은정,이화심,김병주,이계호",2015-12-15,분석과학 (ANALYTICAL SCIENCE & TECHNOLOGY)
851,Quantitative analysis of melanin content in a three-dimensional melanoma cell culture,00994,"정수빈,임기쁨,이지연",2019-12-01,SCIENTIFIC REPORTS
852,Quantitative analysis of Si1-x Gex alloy films by SIMS and XPS depth profiling using a reference material,00692,"오원진,장종식,이연승,김안순,김경중",2018-02-28,APPLIED SURFACE SCIENCE
853,Quantitative depth profile analysis of InP/InGaAs hetero-interfaces by as carry-over,00749,"최민혁,정인영,송승우,김창수",2020-12-01,MAT SCI SEMICON PROC
854,Quantitative Proteomic Analysis of 2D and 3D Cultured Colorectal Cancer Cells: Profiling of Tankyrase Inhibitor XAV939-Induced Proteome,00965,"김영은,전효진,김다희,이선영,김기영,홍종기,맹필재,김광록,강덕진",2018-12-01,SCIENTIFIC REPORTS
855,Quantum Electronic Transport of Topological Surface States in β-Ag2Se Nanowire,00795,"김지환,김진희,김봉수,황아름,이상훈,지승훈,이성훈,박윤창,김시인,김홍석,도용주",2016-03-28,ACS Nano
856,Quantum mechanical current-to-voltage conversion with quantum Hall resistance array,00991,"채동훈,김문석,김완섭,Takehiko Oe,Nobu-Hisa Kaneko",2020-02-01,METROLOGIA
857,Quantum optical measurements with undetected photons through vacuum feld indistinguishability,01166,"이선경,윤태현,조민행",2017-07-26,SCIENTIFIC REPORTS
858,Quantum reservoir engineering through quadratic optomechanical interaction in the reversed dissipation regime,01054,"이재훈,석효준",2018-01-04,PHYSICAL REVIEW A
859,Quantum Teleportation of Shared Quantum Secret,00869,"이상민,이승우,정현석,박희수",2020-02-11,PHYSICAL REVIEW LETTERS
860,Quantum Teleportation of Shared Quantum Secret,01103,"이상민,이승우,정현석,박희수",2020-02-11,PHYSICAL REVIEW LETTERS
861,Quantum transport properties of single-crystalline Ag 2 Se 0.5 Te 0.5 nanowires as a new topological material,01063,"김민진,김지환,이인호,한우현,박윤창,김우연,김봉수,서준호",2019-03-28,NANOSCALE
862,Quenching factor measurement for NaI(Tl) scintillation crystal,00834,"주한울,박현서,김정호,이주영,김선기,김영덕,이현수,김성현",2019-03-01,ASTROPARTICLE PHYSICS
863,Quickly Alternating Green and Red Laser Source for Real-time Multispectral Photoacoustic Microscopy,00981,"박상민,김도연,조순우,김법민,이태걸,김창석,이상원",2020-12-01,Photoacoustics
864,Rapid Genotyping of Human Papillomavirus by Desorption Electrospray Ionization Mass Spectrometry,00816,"김신혜,홍선표,조우재,김정원,이태걸,윤소희",2017-06-15,Bulletin of the Korean Chemical Society
865,Rapid Genotyping of Human Papillomavirus by Desorption Electrospray Ionization Mass Spectrometry,00960,"김신혜,홍선표,조우재,김정원,이태걸,윤소희",2017-06-15,Bulletin of the Korean Chemical Society
866,Ratio Correction Factor and Phase Displacement at Arbitrary Burdens in Instrument Transformers,00814,"정재갑,김규태,이영섭",2016-09-01,JEET(Journal of Electrical Engineering & Technology)
867,Rational and Facile Construction of 3D Annular Nanostructures with Tunable Layers by Exploiting the Diffraction and Interference of Light,01039,"최종호,박규환,유은아",2016-08-02,ADVANCED FUNCTIONAL MATERIALS
868,"Rationally designed, multifunctional self-assembled nanoparticles for covalently networked, flexible and self-healable superhydrophobic composite films",01039,"이유진,유은아,하영근",2018-03-21,ACS Applied Materials & Interfaces
869,Realization of 5 h/e^2 with graphene quantum Hall resistance array,01067,"박재성,김완섭,채동훈",2020-03-04,APPLIED PHYSICS LETTERS
870,Realization of an ultrathin acoustic lens for subwavelength focusing in the megasonic range,00819,"현재엽,김용태,도일,안봉영,백경민,김세화",2018-12-01,SCIENTIFIC REPORTS
871,Realization of the kilogram using the KRISS Kibble balance,01018,"김동민,이광철,김명현,서민기,우병칠,이성준,김종안,채동훈,김문석,최인묵",2020-09-07,METROLOGIA
872,Realization of the Spectral Responsivity Scale based on an Absolute Cryogenic Radiometer,00962,"홍기석,박성종,김승관,박승남,이동훈",2015-12-31,Journal of the Korean Physical Society
873,Realization of the Spectral Responsivity Scale based on an Absolute Cryogenic Radiometer,00841,"홍기석,박성종,김승관,박승남,이동훈",2015-12-31,Journal of the Korean Physical Society
874,Realization of tin freezing point using a loop heat pipe-based hydraulic temperature control technique,00754,"정욱철,감기술,김용규",2015-09-24,METROLOGIA
875,Real-time and label-free monitoring of nanoparticle cellular uptake using capacitance-based assays,00816,"이리미,나희경,김정훈,이태걸",2016-09-19,SCIENTIFIC REPORTS
876,Real-time estimation of paracellular permeability of cerebral endothelial cells by capacitance sensor array,00816,"이리미,조동현,김진형,준형오,이태걸,김정훈",2015-06-05,SCIENTIFIC REPORTS
877,Real-time functional optical-resolution photoacoustic microscopy using high-speed alternating illumination at 532 and 1064 nm,00981,"강희성,이상원,박상민,조순우,이재용,김창석,이태걸",2018-03-05,Journal of Biophotonics
878,Real-time functional optical-resolution photoacoustic microscopy using high-speed alternating illumination at 532 and 1064 nm,00816,"강희성,이상원,박상민,조순우,이재용,김창석,이태걸",2018-03-05,Journal of Biophotonics
879,Real-time GPU-accelerated processing and volumetric display for wide-field laser-scanning optical-resolution photoacoustic microscopy,00981,"강희성,이상원,이은수,김세화,이태걸",2015-11-02,BIOMED OPT EXPRESS
880,Real-time GPU-accelerated processing and volumetric display for wide-field laser-scanning optical-resolution photoacoustic microscopy,00816,"강희성,이상원,이은수,김세화,이태걸",2015-11-02,BIOMED OPT EXPRESS
881,Real-time monitoring of a botulinum neurotoxin using all-carbon nanotube-based field-effect transistor devices,00563,"이남희,남승훈,최인성",2018-12-03,SENSORS
882,Real-time Monitoring of Biomarkers in Serum for Early Diagnosis of Target Disease,01123,"김동형,백성호,최다연,이민경,박지나,조현모,백세환",2020-03-01,Biochip journal
883,Real-Time Monitoring of Colloidal Crystallization in Electrostatically-Levitated Drops,00926,"황혜림,조용찬,이수형,이근우",2020-02-12,Small
884,Recent advances in mass spectrometry-based proteomics of gastric cancer,01019,"강창원,이예진,이진환",2016-10-07,World Journal of Gastroenterology
885,Recent Advances in Tactile Sensing Technology,00830,"박민훈,복보규,안종현,김민석",2018-06-25,MICROMACHINES
886,Reducing individual difference and temperature dependency of QCM humidity sensors based on graphene oxides through normalization of frequency shifts,01049,"이상욱,최병일,김종철,우상봉,김용규",2020-06-15,SENSORS AND ACTUATORS B-CHEMICAL
887,Reduction and compensation of humidity measurement errors at cold temperatures using dual QCM humidity sensors based on graphene oxides,01049,"이상욱,최병일,김종철,우상봉,김용규,유제승,서영수",2019-04-01,SENSORS AND ACTUATORS B-CHEMICAL
888,Reduction of bias in the evaluation of fractional anisotropy and mean diffusivity in magnetic resonance diffusion tensor imaging using region-of-interest methodology,01013,"서영섭,Nancy K. Rollins,Zhiyue J. Wang",2019-12-01,SCIENTIFIC REPORTS
889,Reference Materials for Calibration of Analytical Biases in Quantification of DNA methylation,00871,"유한나,외부,양인철",2015-09-14,PLOS ONE
890,REFERENCE RADIOMETER IN A DUAL-PHOTODIODE DESIGN FOR CALIBRATION OF UVA IRRADAINCE METERS,00434,"신동주,박성종,정기룡,이동훈",2019-06-14,Proceedings of 29th CIE Session
891,Reference thermal neutron field at KRISS for calibration of neutron detectors,01110,"김윤호,박현서,김용균,김정호,강정수",2017-12-01,Radiation Measurements
892,Reflective Fourier ptychographic microscopy using a parabolic mirror,01101,"이휘형,전병혁,안희경",2019-11-11,OPTICS EXPRESS
893,Relative time multiplexing of heralded telecom-band single-photon sources using switchable optical fiber delays,00869,"이은주,이상민,박희수",2019-08-19,OPTICS EXPRESS
894,Relaxation dynamics of photoexcitations in TiO2 and its composites with Au/carbon nanotube (graphene),00760,"Vu Duc Chinh,Nguyen Quang Liema,조한샘,정세채",2020-05-01,CATAL COMMUN
895,Reliability and Validity of the Cerebral Palsy Quality of Life Questionnaire in the South Korean Population,00877,"임현균,고주연",2018-12-31,대한인간공학회지
896,"Reliability of thermal conductivity measurement of liquids by using transient hot-wire, photon correlation spectroscopy and the laser flash method",00842,"권수용,이주현,김대호",2016-06-05,Journal of the Korean Physical Society
897,"Reliability of thermal conductivity measurement of liquids by using transient hot-wire, photon correlation spectroscopy and the laser flash method",01010,"권수용,이주현,김대호",2016-06-05,Journal of the Korean Physical Society
898,Removal of aluminum from the dissolved alumina matrix by NH4OH precipitation and chelate ion exchange resin,00429,"서정기,김창수,한명섭,이화심",2016-03-01,Bulletin of the Korean Chemical Society
899,Removal of aluminum from the dissolved alumina matrix by NH4OH precipitation and chelate ion exchange resin,00564,"서정기,김창수,한명섭,이화심",2016-03-01,Bulletin of the Korean Chemical Society
900,Removal of virus and toxin using heatable multi walled carbon nanotube web filters,00563,"장훈식,전상구,류권상,남승훈",2016-02-19,AIP ADVANCES
901,Report on APMP key comparison: calibration of angle standards,00768,"강주식,엄태봉",2016-09-07,METROLOGIA Tech. Suppl
902,Report on the APMP.PR-S6 : 2012-2013 supplementary comparison of spectral radiance from 250 nm to 2500 nm,00434,"신동주,박성종,이동훈",2020-01-11,METROLOGIA Tech. Suppl
903,Reproducibility of Crude Oil Spectra Obtained with Ultrahigh Resolution Mass Spectrometry,00812,"손승우,김승준,임용현,김성환",2020-07-21,Analytical Chemistry
904,Reproducibility of the cutoff probe for the measurement of electron density,00803,"김대웅,유신재,권준혁,유광호,서병훈,김정형,윤정식,오왕열",2016-06-01,PHYSICS OF PLASMAS
905,Residual strain sensor using Al-packaged optical fiber and Brillouin optical correlation domain analysis,00793,"최보훈,권일범",2015-03-05,OPTICS EXPRESS
906,Resource conservation using whole body autophagy: Self-digestion of shedded gut lining cells in the small intestine,01122,"유희민,Phil Jun Lee,Namki Cho,Hong Pyo Kim",2020-06-30,Korean Journal of Food Science and Technology
907,Retina phantom for the evaluation of optical coherence tomography angiography based on microfluidic channels,00981,"이현지,나프라,이태걸,도일,이상원",2019-11-01,BIOMED OPT EXPRESS
908,Retina phantom for the evaluation of optical coherence tomography angiography based on microfluidic channels,01050,"이현지,나프라,이태걸,도일,이상원",2019-11-01,BIOMED OPT EXPRESS
