논문번호,논문제목,논문사번,논문저자,논문게재일,논문게재지
945,Signal Processing Considerations on the Optical Measurement of Acoustic Particle Velocities in Free-Field Conditions,00985,"조완호,트리안타필로스",2020-06-01,IEEE Transactions on Instrumentation and Measurement
946,Silica nanoparticles inhibit brown adipocyte differentiation via regulation of p38 phosphorylation,00787,"손민정,김원곤,곽민정,오경진,장원석,민정기,이상철,송남웅,배광희",2015-10-02,NANOTECHNOLOGY
947,Silicon Carbide Deformable Mirror with 37 Actuators for Adaptive Optics,00932,"안교훈,이혁교,양호순,김학용",2015-11-30,Journal of the Korean Physical Society
948,Simulation of Structural Evolution Using Time-Dependent Density-Functional Based Tight-Binding Method,00883,"이승미,T.A. Niehaus",2020-11-01,JOURNAL OF NANOSCIENCE AND NANOTECHNOLOGY
949,Simultaneous detection of nucleotide excision repair events and apoptosis-induced DNA fragmentation in genotoxin-treated cells,00969,"백소윤,한수지,강덕진,외부,최준혁",2018-12-01,SCIENTIFIC REPORTS
950,SIMULTANEOUS EVALUATION OF THERMALAND NON-THERMAL EFFECTS OF HIGH-INTENSITY FOCUSED ULTRASOUND ON ATISSUE-MIMICKING PHANTOM,00819,"김용태,마동희,심재경,김세화",2018-08-01,ULTRASOUND MED BIOL
951,SIMULTANEOUS EVALUATION OF THERMALAND NON-THERMAL EFFECTS OF HIGH-INTENSITY FOCUSED ULTRASOUND ON ATISSUE-MIMICKING PHANTOM,00928,"김용태,마동희,심재경,김세화",2018-08-01,ULTRASOUND MED BIOL
952,Simultaneous improvement in the strength and formability of commercially pure titanium via twinning-induced crystallographic texture control,00953,"원종우,박찬희,홍재근,이종수,홍성구",2019-12-01,SCIENTIFIC REPORTS
953,Simultaneous measurement method of the physical thickness and group refractive index free from a non-measurable range,01028,"박정재,모리 히로키,진종한",2019-08-19,OPTICS EXPRESS
954,Simultaneous measurements of top surface and its underlying film surfaces in multilayer film structure,00967,"김영식,이혁교,A. Davies",2017-12-01,SCIENTIFIC REPORTS
955,Simultaneous optical ignition and spectroscopy of a two-phase spray flame,01080,"이석환,도형록,여재익",2016-01-16,COMBUSTION AND FLAME
956,Single-shot deflectometry for dynamic 3D surface profile measurement by modified spatial-carrier frequency phase-shifting method,00895,"마익,김영식,이혁교",2019-12-01,SCIENTIFIC REPORTS
957,Single-shot freeform surface profiler,00967,"서용범,정효빈,이혁교,김영식,주기남",2020-02-03,OPTICS EXPRESS
958,Skyrmion motion driven by oscillating magnetic field,01070,"문경웅,김덕호,제숭근,전병선,김원동,Z.Q.Qiu,최석봉,황찬용",2016-02-05,SCIENTIFIC REPORTS
959,Sn1-x Se thin films with low thermal conductivity: Role of stoichiometric deviation in thermal transport,00889,"정기욱,정윤환,김제경,송재용,신병하",2018-10-01,Journal of Materials Chemistry C
960,Sn-assisted solid state crystallization of red phosphorus to black phosphorus,00889,"뉴엔비엣치엔,신호선,송재용",2020-03-01,SCRIPTA MATERIALIA
961,Solid State Dynamic Nuclear Polarization of 1H Nuclear Spins at 0.3 T and 4.2 K,01071,심정현,2017-12-20,Journal of the Korean Magnetic Resonance Society
962,Solidified inorganic-organic hybrid electrolyte for all solid state flexible lithium battery,01058,"백승욱,Itaru Honm,김제덕,Dinesh Ran",2017-03-01,J POWER SOURCES
963,Solid-solution alloying of immiscible metals at the nanoscale: Ir and Au,01068,"박선화,박현민,한상수,한상윤,송재용",2016-01-18,RSC ADV
964,Solid-solution alloying of immiscible metals at the nanoscale: Ir and Au,00889,"박선화,박현민,한상수,한상윤,송재용",2016-01-18,RSC ADV
965,Solution electrostatic levitator for measuring surface properties and bulk structures of an extremely supersaturated solution drop above metastable zone width limit,00905,"이수형,조원혁,조용찬,이현휘,이근우",2017-05-02,REVIEW OF SCIENTIFIC INSTRUMEMTS
966,Solution immersed silicon (SIS)-based biosensors: a new approach in biosensing,00329,"만게쉬,조현모,제갈원,조용재,조재흥,오상원,백세환,윤용희,김대석",2015-02-07,ANALYST
967,Sorption/desorption hysteresis of thin-film humidity sensors based ongraphene oxide and its derivative,01049,"이상욱,최병일,김종철,우상봉,김용규,권수용,유제승,서영수",2016-12-01,SENSORS AND ACTUATORS B-CHEMICAL
968,Sound radiation control for uniform directionality in the presence of strong early reflections,01091,장지호,2018-12-01,J AUDIO ENG SOC
969,Spatial and temporal pre-alignment of an X-ray split-and-delay unit by laser light interferometry,00905,"W. Roseker,이수형,M. Walther,R. Rysov,M. Sprung,G. Grubel",2019-04-01,REVIEW OF SCIENTIFIC INSTRUMEMTS
970,Specific heat measurements of CNT nanofluids,01010,"이주현,김대호,윤용진",2019-12-01,INTERNATIONAL JOURNAL OF NANOTECHNOLOGY
971,Spectral Line Shape Analysis Using Hartmann-Tran Profile for Tunable Diode Laser Absorption Spectroscopy of Water Vapor at 1.39 μm,01008,"김예라,임정식",2020-02-25,BULLETIN OF THE KOREAN CHEMICAL SOCIETY
972,Spectral responsivity calibration of the reference radiation thermometer at KRISS by using a super-continuum laser-based high-accuracy monochromatic source,00688,"유용심,외부,박성종,이동훈,김봉학",2016-11-11,METROLOGIA
973,Spectral responsivity measurement of photovoltaic detectors by comparison with a pyroelectric detector on individual nano-second laser pulses,00962,"홍기석,박성종,황지수,Errol Atkinson,PeterManson,이동훈",2017-05-11,METROLOGIA
974,Spectral responsivity measurement of photovoltaic detectors by comparison with a pyroelectric detector on individual nano-second laser pulses,00841,"홍기석,박성종,황지수,Errol Atkinson,PeterManson,이동훈",2017-05-11,METROLOGIA
975,Spectroscopic studies of atomic defects and bandgap renormalization in semiconducting monolayer transition metal dichalcogenides,00904,"정태영,김학성,최상준,Kenji Watanabe,Takashi Taniguchi,이기주,김용성,정수용",2019-12-01,Nature Communications
976,Specular Reflectance Measurements of Dielectric Plates in Millimeter Frequency Range,00801,"강진섭,김정환,강광용,윤대환,박성원",2018-04-30,Journal of Eectromagnetic Engineering and Science
977,"Spin-orbit ab initio and density functional theory investigation of bismuth monoboronyl, BIBO",01008,"문지원,임정식,김중한",2017-02-15,International Journal of Quantum Chemistry
978,Spin-Orbit Torque Driven Magnetization Switching and Precession by Manipulating Thickness of CoFeB/W Heterostructures,01030,"전병선,김용진,김동석,윤정범,김창수,황찬용,문경웅",2020-01-15,Advanced Electronic Materials
979,Squeezed ­light ­driven force detection with an optomechanical cavity in a Mach Zehnder interferometer,01054,"이재훈,이창우,석효준",2020-10-15,SCIENTIFIC REPORTS
980,SQUID-based ultralow-field MRI of a hyperpolarized material using signal amplification by reversible exchange,00959,"이성주,정근홍,심정현,이현준,민세인,채희림,남궁성균,김기웅",2019-12-01,SCIENTIFIC REPORTS
981,Stability analysis of geomagnetic baseline data obtained at Cheongyang observatory in Korea,00622,"샤키라,김완섭,조혜리,박포규",2017-07-07,Geoscientific Instrumentation Methods and Data Systems
982,Stability Monitoring of Acrylamide in Potato Chip Certified Reference Material,00790,"김병주,형석원",2015-01-05,Bulletin of the Korean Chemical Society
983,Stabilization of a Ga-adlayer structure with the zincblende stacking sequence in the GaN(0 0 0 -1) surface at the nanoscale,00904,"이성보,유승주,김근수,김용성,김용민,김진규,한흥남",2017-02-21,NANOSCALE
984,Stable isotope labeled DNA: A new strategy for the quantification of total dna using liquid chromatography-mass spectrometry,01100,"권하정,정지선,배영경,최기환,양인철",2019-03-19,Analytical Chemistry
985,'Stacked Gold Nanodisks for Bimodal Photoacoustic and Optical Coherence Imaging,00816,"강희성,박지수,위정섭,정동근,이상원,이태걸",2017-06-27,ACS Nano
986,Stacking Structures of Few-Layer Graphene Revealed by Phase-Sensitive Infrared Nanoscopy,01002,"권혁상,김덕수,김지환",2015-07-28,ACS Nano
987,Static Residual Tensile Strength Response of GFRP Composite Laminates subjected to Low-Velocity Impact,00562,"김종일,허용학,김용환",2020-08-07,Applied Sciences
988,Strain Measurement Distributed on a Ground Anchor Bearing Plate by Fiber Optic OFDR Sensor,00793,"권용석,서대철,최보훈,전민용,권일범",2018-10-25,Applied Sciences
989,Strain pattern detection of composite cylinders using optical fibers after low velocity impacts,00793,"최보훈,권일범",2018-01-18,COMPOSITES SCIENCE AND TECHNOLOGY
990,Strain-controlled boron and nitrogen doping of amorphous carbon layers for hard mask applications,00903,"김태완,김동빈,김용성,박상현,임성규,박근오,김태성,강상우",2016-10-01,DIAMOND AND RELATED MATERIALS
991,Stranski-Krastanov InAs/GaAsSb quantum dots coupled with sub-monolayer quantum dot stacks as a promising absorber for intermediate band solar cells,01142,"김영호,Il-Wook Cho,Mee-Yi Ryu,김준오,이상준,Keun-Yong Ban,Christiana B. Honsberg",2017-08-17,APPLIED PHYSICS LETTERS
992,Strong enhancement of magnetic order from bulk to stretched monolayer FeSe as Hund’s metals,00997,문창연,2020-10-01,NPJ COMPUTATIONAL MATERIALS
993,Strong Responsivity Enhancement of Quantum Dot-in-a-Well Infrared Photodetectors Using Plasmonic Structures,01060,"김준오,Clayton Fowler,이상준,Augustine Urbas,Zahyun Ku,Jiangfeng Zhou",2019-02-01,Advanced Theory and Simulations
994,Strong Two-Mode Parametric Interaction and Amplification in a Nanomechanical Resonator,01185,"조성완,조성운,조명래,서준호,박희철,김상군,심승보,박윤",2018-06-14,Physical Review Applied
995,Strong Two-Mode Parametric Interaction and Amplification in a Nanomechanical Resonator,00936,"조성완,조성운,조명래,서준호,박희철,김상군,심승보,박윤",2018-06-14,Physical Review Applied
996,Structural analysis of negative ions by postsource decay in time-of-flight secondary ion mass spectrometry,01104,"손진경,손현경,박정대,이태걸",2016-05-01,JOURNAL OF VACUUM SCIENCE & TECHNOLOGY B
997,Structural analysis of negative ions by postsource decay in time-of-flight secondary ion mass spectrometry,00816,"손진경,손현경,박정대,이태걸",2016-05-01,JOURNAL OF VACUUM SCIENCE & TECHNOLOGY B
998,Structural and electrical properties of catalyst-free Si-doped InAs nanowires formed on Si(111),00860,"박동우,전성기,이상준,송재용,김준오,노삼규,김진수",2015-11-19,SCIENTIFIC REPORTS
999,Structural and electrochemical properties of interconnect integrated solid oxide fuel cell,01058,"백승욱,정지훈,최원석,배중면,김정현",2016-10-01,MATERIALS RESEARCH BULLETIN
"1,000",Structural and electronic properties of boron-induced defects on the Si(001) surface,00970,"엄대진,문창연,구자용",2019-10-04,PHYSICAL REVIEW B
"1,001",Structural and Vibrational Properties of Al2O3 under Stress,00883,"이승미,김남운,정인영,김창수,유현웅",2017-09-26,JOURNAL OF NANOSCIENCE AND NANOTECHNOLOGY
"1,002",Structural and Vibrational Properties of Al2O3 under Stress,00749,"이승미,김남운,정인영,김창수,유현웅",2017-09-26,JOURNAL OF NANOSCIENCE AND NANOTECHNOLOGY
"1,003",Structural Characterization of Small Molecular Ions by Ion Mobility Mass Spectrometry in Nitrogen Drift Gas: Improving the Accuracy of Trajectory Method Calculations,01129,"이종화,이현희,Kimberly L. Davidson,Matthew F. Bush,김준곤",2018-04-21,ANALYST
"1,004",Structural defects in a nanomesh of bulk MoS2using an anodic aluminum oxide template for photoluminescence efficiency enhancement,00903,"김동환,김태완,최찬호,정대화,박종후,신재철,강상우",2018-12-01,SCIENTIFIC REPORTS
"1,005",Structural Optimization and Temperature-Dependent Electrical Characterization of GaAs Single-Junction Solar Cells,00860,"Im Sik Han,김종수,이상준",2020-06-01,JOURNAL OF THE KOREAN PHYSICAL SOCIETY
"1,006","Structural, optical and electrical properties of HfO2 thin films deposited at low-temperature using plasma-enhanced atomic layer deposition",00999,"김경문,장진섭,윤순길,윤주영,정낙관",2020-04-25,MATERIALS
"1,007",Structure-charge transfer property relationship in self-assembled discotic liquid-crystalline donor-acceptor dyad and triad thin films,01057,"우제흔,Kwang Jin Lee,Benoit Heinrich,Stephane Mery,Frederic Fages,Loic Mager,Anthony D'Al´eo,Jeong Weon Wu,Fabrice Mathevet,Pascal Andr´,Jean-Charles Ribierre,Yiming Xiao,Eunsun Kim,Leszek Mateusz Mazur,David Kreher,Andr´e-Jean Attias,Katarzyna Matczyszyn,Marek Samoc",2016-06-06,RSC ADV
"1,008",Structures of three ependymin-related proteins suggest their function as a hydrophobic molecule binder.,01019,"Park JK,Kim KY,Park S,Sim YW,김용인,Kim JK,Lee C,Han J,Kim CU,이진환",2019-07-01,IUCrJ
"1,009",Study and design of a lens-type retarding field energy analyzer without a grid electrode,01000,"황준혁,김광일,오가와 타카시,조복래,김동현,박인용",2020-02-01,ULTRAMICROSCOPY
"1,010",Study of effects blood alcohol consumption (BAC) level on drivers physiological behaviour and driving performance under simulated environment,00624,"무랄리,김성은,민승남,이희란,홍승희,박세진",2018-03-19,International Journal of Engineering and Technology
"1,011",Study of Photocatalytic Nano-Particle Effects on the Low Temperature Plasma Ionization Mass Spectrometry,00964,"김단비,윤소희",2018-12-01,JOURNAL OF THE AMERICAN SOCIETY FOR MASS SPECTROMETRY
"1,012",Study of Photocatalytic Nano-Particle Effects on the Low Temperature Plasma Ionization Mass Spectrometry,00960,"김단비,윤소희",2018-12-01,JOURNAL OF THE AMERICAN SOCIETY FOR MASS SPECTROMETRY
"1,013",Sub-Clinical Assessment Method for a Complete Spinal Cord Injury - A Case Study: Do we have a Better Quantitative Evaluation Tool,00877,"임현균,WB McKay,W Wade,AM Sherwod",2016-08-03,JSM Neurosurgery and Spine
"1,014",Sub-megahertz mode-locked thulium-doped fiber laser,00990,"진진화,김승관,임선도",2018-08-01,LASER PHYS LETT
"1,015",Submonolayer Quantum Dots for Optoelectronic Devices,01060,"김준오,김영호,이상준,노삼규",2018-09-01,JOURNAL OF THE KOREAN PHYSICAL SOCIETY
"1,016",Submonolayer Quantum Dots for Optoelectronic Devices,01142,"김준오,김영호,이상준,노삼규",2018-09-01,JOURNAL OF THE KOREAN PHYSICAL SOCIETY
"1,017",Sub-population analysis of deformability distribution in heterogeneous red blood cell population,01050,"이동우,도일,Frans A. Kuypers,조영호",2015-12-25,BIOMEDICAL MICRODEVICES
"1,018",Substrate Dependence of Charged Exciton (Trion) for Single-Layer Molybdenum Disulfide,01002,권혁상,2018-10-01,BULLETIN OF THE KOREAN CHEMICAL SOCIETY
"1,019",Substructure imaging of heterogeneous nanomaterials with enhanced refractive index contrast by using a functionalized tip in photoinduced force microscopy,01173,"장정훈,외부,이은성",2018-12-01,LIGHT-SCIENCE & APPLICATIONS
"1,020",Sulfur-based absolute quantification of proteins using isotope dilution inductively coupled plasma mass spectrometry,00956,"이현석,김숙현,정지선,이용문,임용현",2015-08-19,METROLOGIA
"1,021",Sulfurization-induced growth of single-crystalline high-mobility β-In2S3films on InP,00903,"박혜지,김태완,배혁수,조민혁,정수환,이상준,신재철,강상우",2017-12-01,AIP ADVANCES
"1,022",Superconductors in SQUID-Based Ultralow Field NMR -- Flux-Trapping in Type-II Wires,00987,"황성민,Rainer Kor,김기웅,유권규,이성주,심정현,Martin Bur",2015-06-01,IEEE T APPL SUPERCON
"1,023",Supercritical fluid chromatography coupled with in-source atmospheric pressure ionization hydrogen/deuterium exchange mass spectrometry for compound speciation,00790,"조윤주,최만호,김병주,김성환",2016-04-29,J CHROMATOGR A
"1,024",Support-Area Dependence of Vibration-Insensitive Optical Cavities,00827,"이원규,박상언,박창용,유대혁,허명선,김휘동",2019-04-25,CURRENT OPTICS AND PHOTONICS
"1,025",Surface Color Measurement Uncertainties,00922,"황지수,정기룡",2015-12-25,Journal of the Optical Society of Korea
"1,026",Surface plasmon resonant splitting and merging due to infrared incidence through thermal imaging lens,00860,"황제환,전지연,윤수진,강병수,강상우,김준오,이상준",2015-07-23,ELECTRON LETT
"1,027",Surface structurization and control of CuS particle size by discharge mode of inductively coupled plasma and vapor-phase sulfurization,01097,"최대한,이효창,김태완,라우프섀자드,박혜지,염희중,김정형,성대진,강상우,윤의준",2018-11-07,PLASMA SOURCES SCIENCE & TECHNOLOGY
"1,028",Surface two-level state dissipation in single-crystalline gold nanomechanical resonators,01063,"김민진,김지환,김진희,심승보,김봉수,서준호",2017-02-01,Journal of the Korean Physical Society
"1,029",Surface-sensitive measurement of dielectric screening via atom and electron manipulations,00970,"엄대진,서언미,구자용",2016-11-16,PHYSICAL REVIEW B
476,Final report of APMP.T-S7: APMP regional comparison of Co-C eutectic melting point using Pt/Pd thermocouples,00754,"김용규,Z. Wei,H. Ogura,F. Jahan,Y.P. Singh",2016-04-11,METROLOGIA Tech. Suppl
477,"Final Report of CCQM-K129 Measurement of mole fractions of Cu, In, Ga and Se in Cu(In,Ga)Se2 Films",00692,"김경중,김안순,서정기,장종식",2016-09-01,METROLOGIA Tech. Suppl
478,Final report of CCQM-K96.1 `Determination of amount content of dichromate',00487,"황의진,임영란,Ma Liandi,Wu Bing",2015-07-25,METROLOGIA Tech. Suppl
479,Final Report of International Comparison on Fiber Optic Power Responsivity: APMP.PR-S2,00837,"김승관,이동훈,박승남",2015-06-30,METROLOGIA Tech. Suppl
480,Final report of Key Comparison APMP.EM.RF-K3.F: Bilateral Comparison of Ka-band Horn Antenna Gain,00801,"강진섭,강노원,Masanobu Hirose,Koji Komiyama",2015-10-23,METROLOGIA Tech. Suppl
481,Final report of key comparison APMP.QM-K53comparison of gravimetric preparative capability with 100 μmol/mol of oxygen in nitrogen (bilateral comparison between NIM and KRISS),00873,"이정순,이진복,문동민,Qiao, Han,Zeyi Zhou",2015-01-15,METROLOGIA Tech. Suppl
482,Final report of supplementary comparison for APMP.QM-S7.1: methane in nitrogen at 2000 μmol/mol,01118,"홍기룡,김병문,배현길,이상일",2020-10-27,METROLOGIA Tech. Suppl
483,Final Report on APMP.M.M-K4.1,00503,"정진완,Shih Mean,이성준",2017-01-01,METROLOGIA Tech. Suppl
484,Final Report on APMP.M.M-K4.1,00893,"정진완,Shih Mean,이성준",2017-01-01,METROLOGIA Tech. Suppl
485,Final report on force key comparison APMP.M.F-K2.a and APMP.M.F-K2.b (50 kN and 100 kN),00798,박연규,2019-01-11,METROLOGIA Tech. Suppl
486,Final report: international comparison APMP QM-S7 Methane in nitrogen at 2000 umol/mol,00372,"김병문,배현길,이상일,오상협",2015-06-05,METROLOGIA Tech. Suppl
487,Final report: international comparison APMP QM-S7 Methane in nitrogen at 2000 umol/mol,00946,"김병문,배현길,이상일,오상협",2015-06-05,METROLOGIA Tech. Suppl
488,Flat cutoff probe for real-time electron density measurement in industrial plasm processing,01097,"염희중,김정형,최대한,최은석,윤민영,성대진,유신재,이효창",2020-03-05,PLASMA SOURCES SCIENCE & TECHNOLOGY
489,Flexible galvanic skin response sensor based on vertically aligned silver nanowires,00889,"박선화,박지혜,박한나,박현민,송재용",2018-11-10,SENSORS AND ACTUATORS B-CHEMICAL
490,Flexible galvanic skin response sensor based on vertically aligned silver nanowires,01068,"박선화,박지혜,박한나,박현민,송재용",2018-11-10,SENSORS AND ACTUATORS B-CHEMICAL
491,Fluorine Plasma Corrosion Resistance of Anodic Oxide Film Depending on Electrolyte Temperature,00840,"신재수,김민중,송제범,정낙관,김진태,윤주영",2018-01-29,한국진공학회지
492,Focus on SQUIDs in Biomagnetism,00651,"John Clark,이용호,Justin Sch",2018-06-22,Superconductor science and technology
493,Force sensing model of capactivie hybrid touch sensor using thin-film force sensor and its evaluation,00809,"김영태,김종호,김동기,외부",2015-05-15,INTERNATIONAL JOURNAL OF PRECISION ENGINEERING AND MANUFACTURING
494,"Formation of metastable crystals from supercooled, supersaturated, and supercompressed liquids: Role of crystal-liquid interfacial free energy",00926,이근우,2017-10-29,Crystals
495,Fracture mechanism and electromechanical behavior of chemical vapor deposited graphene on flexible substrate under tension,00953,"이정환,장동원,홍성구,박병천,김재현,정현준,이순복",2017-07-01,CARBON
496,Frequency comb single-photon interferometry,01166,"이선경,한노수,윤태현,조민행",2018-09-04,COMMUNICATIONS PHYSICS
497,Fully international system of units-traceable glycated hemoglobin quantification using two stages of isotope-dilution high-performance liquid chromatographytandem mass spectrometry,00995,"트란 흐엉,임진숙,김주옥,권하정,권계철,정지선",2017-09-01,J CHROMATOGR A
498,Further elucidation of nanofluid thermal conductivity measurement using a transient hot-wire method apparatus,01010,"이주현,유동훈,이병찬,권수용,구준모",2018-02-01,HEAT AND MASS TRANSFER
499,Gain characteristics of SQUID-based RF amplifiers depending on device parameters,00651,"이용호,유권규,김진목,이상길,정연욱,오선정,Yannis Semertzidis",2019-03-31,Progress in Superconductivity and Cryogenics
500,Gas molecule sensing of van der Waals tunnel field effect transistors,00752,"박재성,최홍규,명노준,이윤식,장수경,박희철,황찬용,최춘기,유영준,김호종,최진식,최영규,황치영,김진태,박세린",2017-12-21,NANOSCALE
501,Gas molecule sensing of van der Waals tunnel field effect transistors,01067,"박재성,최홍규,명노준,이윤식,장수경,박희철,황찬용,최춘기,유영준,김호종,최진식,최영규,황치영,김진태,박세린",2017-12-21,NANOSCALE
502,"General Theory of Scalar Wave Scattering by a Composite Particle, One Particle Imbedded in Another",00741,"박병천,외부",2016-04-01,Journal of the Korean Physical Society
503,Generation and measurement of arbitrary four-dimensional spatial entanglement between photons in multicore fibers,00869,"이희정,박희수",2019-01-01,Photonics Research
504,Generation of a highly efficient and tissue-specific tryptophan hydroxylase 1 knockout mouse model,00995,"김형석,Hail Kim,정지선",2018-12-01,SCIENTIFIC REPORTS
505,"Generation of carbon nanowhiskers, nanotips, and nanodots by controlling plasma environment: Ion energy and radical effects",01097,"최대한,염희중,유광호,김정형,성대진,윤의준,이효창",2020-06-01,CARBON
506,Gradient-index phononic crystals for highly dense flexural energy harvesting,01061,"현재엽,최원재,김미소",2019-10-21,APPLIED PHYSICS LETTERS
507,Graphene bubbles and their role in graphene quantum transport,01163,"김학성,Leconte,N.,김호종,하동한,K.Watanabe,T.Taniguch,정재일,정수용",2017-05-14,NANOSCALE
508,Graphene bubbles and their role in graphene quantum transport,00989,"김학성,Leconte,N.,김호종,하동한,K.Watanabe,T.Taniguch,정재일,정수용",2017-05-14,NANOSCALE
509,Graphene-supporting films and low-voltage STEM in SEM toward imaging nanobio materials without staining: Observation of insulin amyloid fibrils,01037,"오가와 타카시,강근원,티에우밍투,권혁상,안상정,Tai Hwan Hac,,조복래",2017-05-01,MICRON
510,Gravimetric Standard Gas Mixtures for Global Monitoring of Atmospheric SF6,01008,"임정식,이진복,문동민,김진석,이정순,Bradley D.",2017-11-21,Analytical Chemistry
511,Gravity Measurement for the KRISS Watt Balance,00824,"최인묵,이광철,이성준,김동민,이호영",2017-06-01,IEEE Transactions on Instrumentation and Measurement
512,Ground based characterization of aerosol spectral optical properties of haze and Asian dust episodes under Asian continental outflow during winter 2014,00993,"정진상,이상일",2017-04-24,Atmospheric Chemistry and Physics
513,Growth Mechanism of Highly Crystalline CdS Spheres with Grainy Surfaces,00902,"김남운,맹희진,전영진,유현웅",2015-09-22,JOURNAL OF NANOSCIENCE AND NANOTECHNOLOGY
514,Growth of Graphene on the Cu(110) Surface,00752,"Otgonbayar Dugerjav,황찬용",2020-05-08,Journal of Physical Chemistry C
515,Growth of highly dense InAs quantum dots with improved crystal quality embedded in an InGaAsSb quantum well,01142,"김영호,Nikolai N Faleev,Keun-Yong Ban,김준오,이상준,Christiana B Honsberg",2016-08-03,JOURNAL OF PHYSICS D-APPLIED PHYSICS
516,Guided formation of sub-5 nm interstitial gaps between plasmonic nanodisks,01104,"손진경,한상우,위정섭,이태걸",2015-05-14,NANOSCALE
517,Guided formation of sub-5 nm interstitial gaps between plasmonic nanodisks,00816,"손진경,한상우,위정섭,이태걸",2015-05-14,NANOSCALE
518,Guiding of dynamic skyrmions using chiral magnetic domain wall,01070,"송무준,문경웅,양승모,황찬용,김갑진",2020-06-01,Applied Physics Express
519,HealthSOS: Real-time Health Monitoring System for Stroke Prognostics,00624,"이크람,박세진",2020-11-25,IEEE Access
520,"Hierarchical, Dual-Scale Structures of Atomically Thin MoS2 for Tunable Wetting",01151,"문지훈,최종현,M.C.Wang,Ali Ashraf,강상우,남성우",2017-02-06,NANO LETTERS
521,"Hierarchical, Dual-Scale Structures of Atomically Thin MoS2 for Tunable Wetting",00903,"문지훈,최종현,M.C.Wang,Ali Ashraf,강상우,남성우",2017-02-06,NANO LETTERS
